{
  "$schema": "schema/dataset.schema.json",
  "schema_version": "2.0",
  "name": "dataset-task-manager",
  "title": "dataset-task-manager",
  "description": "Controlled feature-evolution dataset for a Maven JavaFX task manager with feature mapping files and annotations.",
  "repository": "https://github.com/isselab/dataset-task-manager",
  "license": "MIT",
  "created": "2026-08-12",
  "authors": [
    {
      "name": "ISSE Lab"
    }
  ],
  "provenance": {
    "collection_method": "A Maven JavaFX task manager was evolved through 14 sequential benchmark steps. Each step records the prompts, expected feature-level changes, and manually curated post-step traceability artifacts.",
    "source": "The subject is the task manager seed project in project/, including its feature model, Java source files and JSON persistence layer"
  },
  "benchmark": {
    "execution_model": "sequential",
    "initial_version": "v000",
    "ground_truth_policy": "Each step stores the expected post-step traceability artifacts."
  },
  "contents": {
    "subject": "project",
    "steps": "benchmark/steps.json",
    "documentation": "docs"
  }
}
